,title,link,pubDate,description,page_owner,subject,date_index
0,PTAB Inventor Hour - Episode 27,https://www.uspto.gov/about-us/events/ptab-inventor-hour-episode-27,"Thu, 25 Apr 2024 12:00:00 EST","Are you an inventor, entrepreneur, new practitioner, or someone who wants to learn more about the United States Patent and Trademark Office (USPTO) and Patent Trial and Appeal Board (PTAB)? Join us Thursday, April 25 at noon ET for the next PTAB Inventor Hour webinar, Episode 27. This episode will feature an interview with a special guest, Pete Mehravari, Director of the USPTO’s Global Intellectual Property Academy (GIPA). He’ll educate us about GIPA, World IP Day, and how IP Attachés help U.S. inventors abroad. Episode 27 will also feature:Best practices for conducting conference calls with Judges during an America Invents Act (AIA) proceedingAn introduction to PTAB proceedings involving design patent applications A question-and-answer session will follow the presentation. Please send questions before or during the webinar to PTABInventorHour@uspto.gov. Register here",PTAB,Patent Trial and Appeal Board,20240425
32,Attend DOCX filing training,https://www.uspto.gov/about-us/events/attend-docx-filing-training-187,"Thu, 25 Apr 2024 14:00:00 EST","Join us April 25, 2-3 p.m. ET (online) to learn how to file patent-related documents in DOCX format using Patent Center. You will hear from experts on our eCommerce Modernization (eMod) team, who will provide demonstrations and answer your questions. This session is one of several free training sessions found on the DOCX filing series page.Instructions for joining the Webex training session will be provided via email to each registrant.DOCX is a word processing file format based on open standards and is supported by many popular word processing applications. As an open standard format, DOCX offers a safe and stable basis for authoring and processing intellectual property documents. Learn more about filing in DOCX in this hour-long session.We encourage you to explore DOCX filing using the Patent Center training mode at any time. Training mode does not save or store data in our systems.Register todayFor more information, please contact eMod@uspto.gov. To provide feedback, please visit the eMod IdeaScale.",ecommerce,Patent Center,20240425
34,Federal trademark searching: Overview,https://www.uspto.gov/about-us/events/federal-trademark-searching-overview-3,"Fri, 26 Apr 2024 15:00:00 EST", ,Trademarks,Search,20240426
35,"Trademark Basics Boot Camp, Module 5: Application filing walk-through",https://www.uspto.gov/about-us/events/trademark-basics-boot-camp-module-5-application-filing-walk-through-11,"Tue, 30 Apr 2024 14:00:00 EST","Are you a small business owner or entrepreneur interested in learning about trademarks and how to apply for a federal registration? If so, this event is a must-attend. In this fifth module of our eight-part virtual Trademark Basics Boot Camp, we’ll focus on the USPTO’s Trademark Electronic Application System (TEAS), including a live demonstration of a trademark filing. TEAS is the required system for making any trademark submission to the USPTO. The event is free, but space is limited, so register early.This module will cover the following topics:Trademark basicsTEAS basicsTEAS pre-filing checklistTEAS Plus demonstrationFinding helpThis module will be presented live via Webex from 2-3:30 p.m. ET on Tuesday, April 30, 2024, and will conclude with a question-and-answer session. Please register by April 29.Register todayBe sure to check out our other boot camp modules running consecutively every week for the eight-week duration. You can attend the whole series or just the specific modules that best meet your needs. Separate registration is required for each module. After each event, we'll email registrants links to a video recording of the module and a PDF of the presentation materials. You will only receive access to the recording if you are signed up for that module.For questions about the event or the boot camp series, please contact TMWebinar@uspto.gov.",Trademarks,"Trademarks, Basic Facts, Education, Atlantic, Alexandria VA (Headquarters), Dallas, Denver, Silicon Valley, Detroit",20240430
36,Virtual office hour with USPTO patent examiners,https://www.uspto.gov/jobs/virtual-office-hour-uspto-patent-examiners-12,"Wed, 01 May 2024 12:00:00 EST","Calling all scientists and engineers!Seeking a career at the United States Patent and Trademark Office (USPTO) as a patent examiner? If you are a U.S. citizen and are graduating this year with a focus in…BiologyBiomedical EngineeringChemistryChemical EngineeringComputer EngineeringComputer ScienceDesignElectrical EngineeringMechanical EngineeringPhysics …then bring your questions about the agency, the role, and the hiring process to this informal Q&A session with current USPTO patent examiners on May 1 at noon ET. Our team members are excited to answer your questions, chat with you, and provide you with more information about this opportunity. Join sessionYou do not need to register for this event but come prepared with any questions you may have. We hope to see you there! For more information, contact recruitment@uspto.gov. When you are ready to apply, submit your application via USAJOBS.",OHR,Events,20240501
37,Trademark basics: Learn the fundamentals,https://www.uspto.gov/about-us/events/trademark-basics-learn-fundamentals,"Wed, 01 May 2024 19:00:00 EST", ,Trademarks,Trademark Process,20240501
38,One-day trademarks boot camp,https://www.uspto.gov/about-us/events/one-day-trademarks-boot-camp-16,"Thu, 02 May 2024 09:00:00 EST","Join the United States Patent and Trademark Office (USPTO) for a one-day trademarks boot camp on May 2, 2024 from 9 a.m. to 5 p.m. ET at the Summit Station at Innovation Center in Frostburg, Maryland. This is an in-person, single-day workshop for entrepreneurs, small businesses, and start-ups in communities with limited or no internet access, covering what they should know about trademarks.The event explores what trademarks are, the benefits of federal trademark registration, and the basics of the registration process. We’ll also discuss why it’s so important for any new business to select a trademark that is both federally registrable and legally protectable.Topics will include:Fundamentals and searchingApplications and filingResponses and registrationThere will be plenty of question-and-answer sessions throughout the day, plus a discussion about free resources available through the USPTO. This event is free, but registration is required. For registration information, questions about the one-day event, or the One-day patents and trademarks boot camp series, please email Andriae.Holt@uspto.gov.",Patents,"Patents, SOAR, Training",20240502
39,Ex Parte Appeal Roadshows - Philadelphia,https://www.uspto.gov/about-us/events/ex-parte-appeal-roadshows-philadelphia-pennsylvania,"Thu, 02 May 2024 13:00:00 EST","Are you a Patent Trial and Appeal Board (PTAB) practitioner? Would you like to learn more about ex parte appeal proceedings directly from PTAB judges? Attend an Ex Parte Appeal Roadshow.The PTAB is holding in-person training focusing on best practices to succeed in an appeal on Thursday, May 2, at the Free Library of Philadelphia from 1-5 p.m. ET. PTAB judges will teach all sessions. Topics include:Tips to file an appeal brief efficientlyHow to make written arguments more persuasiveHow to present an effective oral argument before a judge panelSee the agenda for more information. The event is free and registration is encouraged. The Ex Parte Appeal Roadshow will also take place in Los Angeles, Austin, Atlanta, and Indianapolis. See the full schedule for dates. If you have any questions regarding this event, please email PTABEvents@uspto.gov.CLE credit is pending per state for each roadshow location.",PTAB,Patent Trial and Appeal Board,20240502
40,"Trademark Basics Boot Camp, Module 6: Responding to an office action",https://www.uspto.gov/about-us/events/trademark-basics-boot-camp-module-6-responding-office-action-11,"Tue, 07 May 2024 14:00:00 EST","Are you a small business owner or entrepreneur interested in learning about trademarks and how to apply for a federal registration? If so, this event is a must-attend. In this sixth module of our eight-part virtual Trademark Basics Boot Camp, we’ll focus on responding to office actions, the official letters that USPTO examining attorneys issue after reviewing your trademark application. The event is free, but space is limited, so register early.This module will cover the following topics:Trademark basicsOffice action basicsResponse timeframes and deadlinesFiling a responseTips for a successful responseFinding helpThis module will be presented live via Webex from 2-3:30 p.m. ET on Tuesday, May 7, 2024, and will conclude with a question-and-answer session. Please register by May 6. Register todayBe sure to check out our other boot camp modules running consecutively every week for the eight-week duration. You can attend the whole series or just the specific modules that best meet your needs. Separate registration is required for each module. After each event, we'll email registrants links to a video recording of the module and a PDF of the presentation materials. You will only receive access to the recording if you are signed up for that module.For questions about the event or the boot camp series, please contact TMWebinar@uspto.gov.",Trademarks,"Trademarks, Basic Facts, Education, Atlantic, Alexandria VA (Headquarters), Dallas, Denver, Silicon Valley, Detroit",20240507
41,Virtual office hour with USPTO patent examiners,https://www.uspto.gov/jobs/virtual-office-hour-uspto-patent-examiners-13,"Wed, 08 May 2024 12:00:00 EST","Calling all scientists and engineers!Seeking a career at the United States Patent and Trademark Office (USPTO) as a patent examiner? If you are a U.S. citizen and are graduating this year with a focus in…BiologyBiomedical EngineeringChemistryChemical EngineeringComputer EngineeringComputer ScienceDesignElectrical EngineeringMechanical EngineeringPhysics …then bring your questions about the agency, the role, and the hiring process to this informal Q&A session with current USPTO patent examiners on May 8 at noon ET. Our team members are excited to answer your questions, chat with you, and provide you with more information about this opportunity. Join sessionYou do not need to register for this event but come prepared with any questions you may have. We hope to see you there! For more information, contact recruitment@uspto.gov. When you are ready to apply, submit your application via USAJOBS.",OHR,Events,20240508
42,"The Path to a Patent, Part V: Understanding the role of claims in a patent application",https://www.uspto.gov/about-us/events/path-patent-part-v-understanding-role-claims-patent-application-5,"Thu, 09 May 2024 14:00:00 EST","Are you an inventor preparing to file a patent application? In part five of this eight-part recurring series, our experts will discuss the parts of the claim, show examples of claim illustrations from issued U.S. patents, and help participants develop a better appreciation of how a patent examiner views a claim. To get the most out of this workshop, you should have an intermediate knowledge of the intellectual property (IP) system and of patents specifically. We recommend that you complete the previous sessions in the series, Part I: IP basics and Part IV: Learn how to draft your patent application, before attending.Register todayFor more information, please email RockyMountain@uspto.gov or SiliconValley@uspto.gov.",Svalley,"Atlantic, Dallas, Denver, Silicon Valley, Detroit",20240509
43,PTAB LEAP: AIA mock oral argument practicum,https://www.uspto.gov/about-us/events/ptab-leap-aia-mock-oral-argument-practicum,"Fri, 10 May 2024 13:00:00 EST","Please join us for an America Invents Act (AIA) mock oral argument practicum as part of the Legal Experience and Advancement Program (LEAP) at the Patent Trial and Appeal Board (PTAB). The event will take place Friday, May 10, from 1-4 p.m. ET.The practicum will offer an opportunity for practitioners to hone their oral argument skills by presenting an AIA mock argument to a panel of sitting administrative patent judges. Participants will receive substantive feedback from the panel and will have an opportunity to engage in a question-and-answer session with the judges.Space is limited. Apply by Friday, March 29, 2024, to participate. Selected applicants will be notified by email.Apply todayPreference will be given to LEAP-eligible attorneys and agents, and to those who have not participated in prior LEAP mock argument practicums.More information about LEAP is available on the U.S. Patent and Trademark Office's (USPTO) LEAP webpage. Please contact LEAP@uspto.gov with any questions.",PTAB,Patent Trial and Appeal Board,20240510
44,"Trademark Basics Boot Camp, Module 7: Keeping your registration alive",https://www.uspto.gov/about-us/events/trademark-basics-boot-camp-module-7-keeping-your-registration-alive-14,"Tue, 14 May 2024 14:00:00 EST","Are you a small business owner or entrepreneur interested in learning about trademarks and how to apply for a federal registration? If so, this event is a must-attend. In this seventh module of our eight-part virtual Trademark Basics Boot Camp, we’ll focus on what happens after registration, including mandatory filings to keep your registration alive. The event is free, but space is limited, so register early.This module will cover the following topics:Trademark basicsRequired post-registration filingsOptional post-registration filingsExamination of post-registration filingsFinding helpThis module will be presented live via Webex from 2-3:30 p.m. ET on Tuesday, May 14, 2024, and will conclude with a question-and-answer session. Please register by May 13.Register todayBe sure to check out our other boot camp modules running consecutively every week for the eight-week duration. You can attend the whole series or just the specific modules that best meet your needs. Separate registration is required for each module. After each event, we'll email registrants links to a video recording of the module and a PDF of the presentation materials. You will only receive access to the recording if you are signed up for that module.For questions about the event or the boot camp series, please contact TMWebinar@uspto.gov.",Trademarks,"Trademarks, Basic Facts, Education, Atlantic, Alexandria VA (Headquarters), Dallas, Denver, Silicon Valley, Detroit",20240514
45,A day in the life of a USPTO patent examiner,https://www.uspto.gov/jobs/day-life-uspto-patent-examiner-3,"Wed, 15 May 2024 12:00:00 EST","Do you want a challenging career? Would you like the opportunity to work from home nationwide with a ﬂexible schedule? Do you want to be a part of a culture of inclusivity and camaraderie, and a community that leads America toward breakthroughs in innovation? Are you a U.S. citizen graduating this year with a focus in any of these fields?	Biology	Biomedical Engineering	Chemistry	Chemical Engineering	Computer Engineering	Computer Science	Design	Electrical Engineering	Mechanical Engineering	Physics 	If you answered yes to any of these questions, you may belong at the United States Patent and Trademark Office (USPTO) as a patent examiner! We recruit the most promising at America’s Innovation Agency, and we encourage you to take the step forward in your journey today by joining us on May 15 at noon ET for an informational webinar on becoming a patent examiner.",OHR,Events,20240515
46,"The Path to a Patent, Part VI: Learn how to protect your IP abroad",https://www.uspto.gov/about-us/events/path-patent-part-vi-learn-how-protect-your-ip-abroad-5,"Thu, 16 May 2024 14:00:00 EST","Did you know that patents offer territorial rights, meaning that there is no such thing as an international or global patent? Learn how to help protect your intellectual property (IP) in foreign jurisdictions.In part six of this eight-part recurring series, International Patent Legal Administration experts will discuss considerations and options for filing foreign patent applications. The discussion will include an overview of the Patent Cooperation Treaty (PCT) and the use of the Paris Convention for non-PCT countries.Register todayFor more information, please email SiliconValley@uspto.gov or RockyMountain@uspto.gov.",Svalley,"Atlantic, Dallas, Denver, Silicon Valley, Detroit",20240516
47,"Trademark Basics Boot Camp, Module 8: Question-and-answer panel",https://www.uspto.gov/about-us/events/trademark-basics-boot-camp-module-8-question-and-answer-panel-13,"Tue, 21 May 2024 14:00:00 EST","Are you a small business owner or entrepreneur interested in learning about trademarks and how to apply for a federal registration? If so, this event is a must-attend. In this final module of our eight-part virtual Trademark Basics Boot Camp, we’ll provide a unique opportunity for you to “meet the trademark experts.” Come prepared with all of your trademark questions to share with our Law Office Managing Attorneys and other trademark experts. The event is free, but space is limited, so register early.This module will be presented live via Webex from 2-3:30 p.m. ET on Tuesday, May 21, 2024. Please register by May 20. Register todayBe sure to check out our other boot camp modules running consecutively every week for the eight-week duration. You can attend the whole series or just the specific modules that best meet your needs. Separate registration is required for each module. After each event, we'll email registrants links to a video recording of the module and a PDF of the presentation materials. You will only receive access to the recording if you are signed up for that module.For questions about the event or the boot camp series, please contact TMWebinar@uspto.gov.",Trademarks,"Trademarks, Basic Facts, Education, Atlantic, Alexandria VA (Headquarters), Dallas, Denver, Silicon Valley, Detroit",20240521
48,Virtual office hour with USPTO patent examiners,https://www.uspto.gov/jobs/virtual-office-hour-uspto-patent-examiners-14,"Wed, 22 May 2024 12:00:00 EST","Calling all scientists and engineers!Seeking a career at the United States Patent and Trademark Office (USPTO) as a patent examiner? If you are a U.S. citizen and are graduating this year with a focus in…BiologyBiomedical EngineeringChemistryChemical EngineeringComputer EngineeringComputer ScienceDesignElectrical EngineeringMechanical EngineeringPhysics …then bring your questions about the agency, the role, and the hiring process to this informal Q&A session with current USPTO patent examiners on May 22 at noon ET. Our team members are excited to answer your questions, chat with you, and provide you with more information about this opportunity. Join sessionYou do not need to register for this event but come prepared with any questions you may have. We hope to see you there! For more information, contact recruitment@uspto.gov. When you are ready to apply, submit your application via USAJOBS.",OHR,Events,20240522
49,Virtual office hour with USPTO patent examiners,https://www.uspto.gov/jobs/virtual-office-hour-uspto-patent-examiners-15,"Wed, 29 May 2024 12:00:00 EST","Calling all scientists and engineers!Seeking a career at the United States Patent and Trademark Office (USPTO) as a patent examiner? If you are a U.S. citizen and are graduating this year with a focus in…BiologyBiomedical EngineeringChemistryChemical EngineeringComputer EngineeringComputer ScienceDesignElectrical EngineeringMechanical EngineeringPhysics …then bring your questions about the agency, the role, and the hiring process to this informal Q&A session with current USPTO patent examiners on May 29 at noon ET. Our team members are excited to answer your questions, chat with you, and provide you with more information about this opportunity. Join sessionYou do not need to register for this event but come prepared with any questions you may have. We hope to see you there! For more information, contact recruitment@uspto.gov. When you are ready to apply, submit your application via USAJOBS.",OHR,Events,20240529
50,Virtual office hour with USPTO patent examiners,https://www.uspto.gov/jobs/virtual-office-hour-uspto-patent-examiners-16,"Wed, 05 Jun 2024 12:00:00 EST","Calling all scientists and engineers!Seeking a career at the United States Patent and Trademark Office (USPTO) as a patent examiner? If you are a U.S. citizen and are graduating this year with a focus in…BiologyBiomedical EngineeringChemistryChemical EngineeringComputer EngineeringComputer ScienceDesignElectrical EngineeringMechanical EngineeringPhysics …then bring your questions about the agency, the role, and the hiring process to this informal Q&A session with current USPTO patent examiners on June 5 at noon ET. Our team members are excited to answer your questions, chat with you, and provide you with more information about this opportunity. Join sessionYou do not need to register for this event but come prepared with any questions you may have. We hope to see you there! For more information, contact recruitment@uspto.gov. When you are ready to apply, submit your application via USAJOBS.",OHR,Events,20240605
51,Trademark basics: Learn the fundamentals,https://www.uspto.gov/about-us/events/trademark-basics-learn-fundamentals-0,"Wed, 05 Jun 2024 19:00:00 EST", ,Trademarks,Trademark Process,20240605
52,One-day patents boot camp,https://www.uspto.gov/about-us/events/one-day-patents-boot-camp-10,"Thu, 06 Jun 2024 10:00:00 EST","Join the United States Patent and Trademark Office (USPTO) for a one-day patents boot camp on June 6, 2024, from 9 a.m. to 5 p.m. CT at the Small Business Development Center in Hammond, Louisiana. This in-person, single-day workshop is for entrepreneurs, small businesses, and inventors in communities with limited or no internet access, covering tools, techniques, and resources to understand the patent application process.The event provides a scaffolded approach to understanding patents and intellectual property (IP) rights, the importance of claims in a patent application, and the various patent application requirements. It also includes:How to search prior artHow to properly draft claims Understanding the application formsHow to use Patent Center to file electronicallyThere will be plenty of question-and-answer sessions throughout the day, plus a discussion about free resources available through the USPTO. This event is free, but registration is required. For registration information, questions about the one-day event or the One-day patent and trademark boot camp series, please email Andriae.Holt@uspto.gov.",Patents,"Patents, SOAR, Training",20240606
53,"The Path to a Patent, Part VII: How to file a patent application using Patent Center",https://www.uspto.gov/about-us/events/path-patent-part-vii-how-file-patent-application-using-patent-center-5,"Thu, 06 Jun 2024 14:00:00 EST","Looking for more information on using Patent Center? In part seven of this eight-part recurring series, our experts will teach participants how to use this tool to file and manage patent documents online.This presentation will feature filing application documents in DOCX format, including using Patent Center training mode to practice filing. You will learn about some helpful resources, such as the Inventors Assistance Center (IAC) and the Patent Electronics Business Center (EBC). Register todayFor more information, please email RockyMountain@uspto.gov or SiliconValley@uspto.gov.",Svalley,"Alexandria VA (Headquarters), Dallas, Denver, Silicon Valley, Detroit",20240606
54,Virtual office hour with USPTO patent examiners,https://www.uspto.gov/jobs/virtual-office-hour-uspto-patent-examiners-17,"Wed, 12 Jun 2024 12:00:00 EST","Calling all scientists and engineers!Seeking a career at the United States Patent and Trademark Office (USPTO) as a patent examiner? If you are a U.S. citizen and are graduating this year with a focus in…BiologyBiomedical EngineeringChemistryChemical EngineeringComputer EngineeringComputer ScienceDesignElectrical EngineeringMechanical EngineeringPhysics …then bring your questions about the agency, the role, and the hiring process to this informal Q&A session with current USPTO patent examiners on June 12 at noon ET. Our team members are excited to answer your questions, chat with you, and provide you with more information about this opportunity. Join sessionYou do not need to register for this event but come prepared with any questions you may have. We hope to see you there! For more information, contact recruitment@uspto.gov. When you are ready to apply, submit your application via USAJOBS.",OHR,Events,20240612
55,"The Path to a Patent, Part VIII: Common mistakes and post-filing support",https://www.uspto.gov/about-us/events/path-patent-part-viii-common-mistakes-and-post-filing-support-5,"Thu, 13 Jun 2024 14:00:00 EST","Are you an inventor? Join us for this session full of important tips on filing a patent application and what to do after you file for a patent.In the final part of this eight-part recurring series, you will learn about common mistakes to avoid, and you'll gain a better understanding of post-filing procedures and support. Register todayFor more information, please email SiliconValley@uspto.gov or RockyMountain@uspto.gov.",Svalley,"Alexandria VA (Headquarters), Dallas, Denver, Silicon Valley, Detroit",20240613
