,title,link,pubDate,description,page_owner,subject,date_index
0,"Recursos útiles para inventores, innovadores y emprendedores",https://www.uspto.gov/about-us/events/resources-inventors-innovators-and-entrepreneurs-3-es,"Tue, 12 Mar 2024 12:00:00 EST","Si desea aprender más acerca de cómo proteger su propiedad intelectual, no deje pasar la oportunidad de participar en esta sesión informativa.Abordaremos los siguientes temas:Recursos disponibles en la Oficina de Patentes y Marcas Registradas de los EE. UU. (USPTO, por sus siglas en inglés) Ayuda gratuita disponible para inventores y emprendedoresRegístrese hoyPara obtener más información, envíe un correo electrónico a EasternRegionalOutreachOffice@USPTO.gov.Acomodo razonableSi usted tiene una discapacidad, puede solicitar acomodo razonable a la dirección EasternRegionalOutreachOffice@USPTO.gov.",Eastern Outreach,"Alexandria VA (Headquarters), Dallas, Denver, Silicon Valley, Detroit",20240312
6,Virtual office hour with USPTO patent examiners,https://www.uspto.gov/jobs/virtual-office-hour-uspto-patent-examiners-7,"Wed, 13 Mar 2024 12:00:00 EST","Calling all scientists and engineers!Seeking a career at the United States Patent and Trademark Office (USPTO) as a patent examiner? If you are a U.S. citizen and are graduating this year with a focus in…BiologyBiomedical EngineeringChemistryChemical EngineeringComputer EngineeringComputer ScienceDesignElectrical EngineeringMechanical EngineeringPhysics …then bring your questions about the agency, the role, and the hiring process to this informal Q&A session with current USPTO patent examiners on March 13, at noon ET. Our team members are excited to answer your questions, chat with you, and provide you with more information about this opportunity. Join sessionYou do not need to register for this event but come prepared with any questions you may have. We hope to see you there! For more information, contact recruitment@uspto.gov. When you are ready to apply, submit your application via USAJOBS.",OHR,Events,20240313
7,Fundamentos básicos de las patentes,https://www.uspto.gov/about-us/events/fundamentos-basicos-de-las-patentes-1,"Wed, 13 Mar 2024 12:00:00 EST","¿Le interesa aprender acerca de los fundamentos de la propiedad intelectual y las patentes? Le invitamos a una sesión virtual gratuita en la que exploraremos los diferentes tipos de patentes, incluyendo patentes de utilidad, de diseño y de plantas. Además, expertos de la Oficina de Patentes y Marcas de EE. UU. (USPTO, por sus siglas en inglés) explicarán la diferencia entre las solicitudes de patentes provisionales y las no provisionales, y cómo utilizarlas.Los asistentes también aprenderán acerca de: El proceso de tramitación de patentesLa función de los examinadores de patentes de la USPTOQué esperar al trabajar con la USPTO para obtener una patenteRecursos disponibles a través de la USPTO para proteger su propiedad intelectualRegístrese hoyPara aprender más, por favor visite la página de Fundamentos de patentes de la USPTO. Para obtener más información acerca de este evento, escriba a EasternRegionalOutreachOffice@uspto.gov.",Eastern Outreach,"Alexandria VA (Headquarters), Dallas, Denver, Silicon Valley, Detroit",20240313
8,Formerly Incarcerated Innovation and Entrepreneurship program: Overcoming challenge with innovation,https://www.uspto.gov/initiatives/equity/learn-how-formerly-incarcerated-innovator-defied-odds-become-patented-inventor,"Thu, 14 Mar 2024 14:00:00 EST", ,Inventor Resources,"Inventor Resources, Trademarks, Office Locations",20240314
9,One-day trademarks boot camp,https://www.uspto.gov/about-us/events/one-day-trademarks-boot-camp-15,"Thu, 14 Mar 2024 09:00:00 EST","Join the United States Patent and Trademark Office (USPTO) for a one-day trademarks boot camp on March 14, 2024 from 9 a.m. to 5 p.m. ET at UMES Center for Entrepreneurship and Innovation in Princess Anne, Maryland. This is an in-person, single-day workshop for entrepreneurs, small businesses, and start-ups in communities with limited or no internet access, covering what they should know about trademarks.The event explores what trademarks are, the benefits of federal trademark registration, and the basics of the registration process. We’ll also discuss why it’s so important for any new business to select a trademark that is both federally registrable and legally protectable.Topics will include:Fundamentals and searchingApplications and filingResponses and registrationThere will be plenty of question-and-answer sessions throughout the day, plus a discussion about free resources available through the USPTO. This event is free, but registration is required. For registration information, questions about the one-day event, or the One-day patents and trademarks boot camp series, please email Andriae.Holt@uspto.gov.",Patents,"Patents, SOAR, Training",20240314
10,Attend DOCX filing training,https://www.uspto.gov/about-us/events/attend-docx-filing-training-182,"Thu, 14 Mar 2024 14:00:00 EST","Join us March 14, 2-3 p.m. ET (online) to learn how to file patent-related documents in DOCX format using Patent Center. You will hear from experts on the United States Patent and Trademark Office's (USPTO) eCommerce Modernization (eMod) team, who will provide demonstrations and answer your questions. This session is one of several free training sessions found on the DOCX filing series page.Instructions for joining the Webex training session will be provided via email to each registrant.DOCX is a word processing file format based on open standards and is supported by many popular word processing applications. As an open standard format, DOCX offers a safe and stable basis for authoring and processing intellectual property documents. Learn more about filing in DOCX in this hour-long session.We encourage you to explore DOCX filing using the Patent Center training mode at any time. Training mode does not save or store data in USPTO systems.Register todayFor more information, please contact eMod@uspto.gov. To provide feedback, please visit the eMod IdeaScale.",ecommerce,Patent Center,20240314
11,Fundamentos básicos de las marcas registradas,https://www.uspto.gov/about-us/events/fundamentos-basicos-de-las-marcas-registradas-1,"Thu, 14 Mar 2024 12:00:00 EST","¿Es usted un emprendedor o propietario de un negocio pequeño? ¿Tiene un nombre o logotipo que usa para promover o anunciar su negocio?Acompañe a los expertos de la Oficina de Patentes y Marcas de EE. UU. (USPTO, por sus siglas en inglés) en una sesión informativa en la que exploraremos los diferentes tipos de marcas registradas, incluyendo nombres de las marcas, diseños, logotipos e imágenes comerciales.También se discutirá:Cómo usar nuestra base de datos para encontrar marcas que podrían confligir con la suyaCómo elegir marcas registradas distintivas Los pasos para presentar una solicitud de marca registradaLas tarifas para presentar una solicitud y mantener una marca registradaRegístrese hoyPara aprender más, visite nuestra página de Fundamentos de las marcas registradas.Para obtener más información, escriba a EasternRegionalOutreachOffice@USPTO.gov.",Eastern Outreach,"Alexandria VA (Headquarters), Dallas, Denver, Silicon Valley, Detroit",20240314
12,Aprenda cómo proteger su tecnología en el extranjero,https://www.uspto.gov/about-us/events/aprenda-como-proteger-su-tecnologia-en-el-extranjero-1,"Fri, 15 Mar 2024 12:00:00 EST","¿Sabía que hay maneras de proteger su patente en otro país?Si desea saber cómo presentar solicitudes de patentes en jurisdicciones extranjeras, le invitamos a esta sesión gratuita que ofrecerán los expertos de la Oficina de Patentes y Marcas de EE.UU. (USPTO, por sus siglas en inglés). Se discutirán temas como:Las opciones para ayudar a proteger su propiedad intelectual en jurisdicciones extranjerasUna descripción general del Tratado de Cooperación en materia de Patentes (PCT, por sus siglas en inglés)El uso del Convenio de París para países que no están afiliados al PCTRegístrese hoyPara aprender más, visite la página sobre el Tratado de Cooperación en materia de Patentes en nuestra página web.Para obtener más información sobre este evento, escriba a EasternRegionalOutreachOffice@USPTO.gov.",Eastern Outreach,"Alexandria VA (Headquarters), Dallas, Denver, Silicon Valley, Detroit",20240315
13,Federal trademark searching: Overview,https://www.uspto.gov/about-us/events/federal-trademark-searching-overview-0,"Fri, 15 Mar 2024 15:00:00 EST", ,Trademarks,Search,20240315
0,Entrepreneurship Essentials Roadshow and Resource Fair,https://www.uspto.gov/about-us/events/entrepreneurship-essentials-roadshow-and-resource-fair-0,"Sat, 16 Mar 2024 09:30:00 EST", ,Texas,"Events, Intellectual Property (IP), Training, Inventor Resources, Services, Military Communities",20240316
16,Learn the fundamentals of the patent application process,https://www.uspto.gov/about-us/events/learn-fundamentals-patent-application-process-4,"Tue, 19 Mar 2024 09:00:00 EST","Do you have an invention you want to patent? Are you unfamiliar with the patent filing process? Are you a first-time patent application filer or new to the Patent Center? Are you unsure where to start?Get a head StART with this free, virtual three-day workshop that focuses on helping participants learn the fundamentals of the patent application process. The Stakeholder Application Readiness Training (StART) is for independent inventors, entrepreneurs, and anyone working for or with a small business who want to file patent applications without the assistance of a registered patent agent or attorney.Patent protection is critical to:Safeguarding products and services from imitationAttracting and securing funding from outside investorsPromoting the overall commercial success of any enterpriseThe StART program is one of many initiatives and activities that form part of the USPTO’s mission. Participants of the StART three-day workshop will receive training from experts on:Types of patent applicationsPrior art searchesScope of claimsFormality requirementsClaim writing and claim draftingProper application forms (provisional, design, and non-provisional)Application data sheetPatent CenterDOCX filesParticipants may also choose to participate in one-on-one assistance breakout room discussions.Complete interest formInstructions for joining the training session are provided via email to each registrant. For more information, email setd@uspto.gov.",Patent Stakeholders,"Patents, START, About Us, Education",20240319
17,Attend DOCX filing training,https://www.uspto.gov/about-us/events/attend-docx-filing-training-183,"Tue, 19 Mar 2024 14:00:00 EST","Join us March 19, 2-3 p.m. ET (online) to learn how to file patent-related documents in DOCX format using Patent Center. You will hear from experts on the United States Patent and Trademark Office's (USPTO) eCommerce Modernization (eMod) team, who will provide demonstrations and answer your questions. This session is one of several free training sessions found on the DOCX filing series page.Instructions for joining the Webex training session will be provided via email to each registrant.DOCX is a word processing file format based on open standards and is supported by many popular word processing applications. As an open standard format, DOCX offers a safe and stable basis for authoring and processing intellectual property documents. Learn more about filing in DOCX in this hour-long session.We encourage you to explore DOCX filing using the Patent Center training mode at any time. Training mode does not save or store data in USPTO systems.Register todayFor more information, please contact eMod@uspto.gov. To provide feedback, please visit the eMod IdeaScale.",ecommerce,Patent Center,20240319
14,Trademark practitioners: Avoid attorney scams and bad behavior,https://www.uspto.gov/about-us/events/trademark-practitioners-avoid-attorney-scams-and-bad-behavior,"Tue, 19 Mar 2024 14:00:00 EST", ,Trademarks,Trademark Process,20240319
0,"Attend the Biotechnology, Chemical, and Pharmaceutical (BCP) Customer Partnership Meeting",https://www.uspto.gov/about-us/events/attend-biotechnology-chemical-and-pharmaceutical-bcp-customer-partnership-meeting-0,"Tue, 19 Mar 2024 12:00:00 EST","Share your insight and experience to improve patent prosecution in biotechnology areas at the United States Patent and Trademark Office’s (USPTO) next Biotechnology, Chemical, and Pharmaceutical (BCP) Customer Partnership Meeting on Tuesday, March 19, from noon to 5 p.m. ET. The meeting will be held in person at the USPTO headquarters in Alexandria, Virginia. It will also be held in person at the USPTO Silicon Valley Regional Office in San Jose, California, and will be available online.BCP meetings are part of a long-standing partnership between the USPTO and our valued stakeholders that works to improve the quality of our products and services. The meeting’s discussion topics include:Prior art in a litigation worldAfter final practice and request for continued examinationUsing Food and Drug Administration and National Institutes of Health databases to search drugs, formulations and their methods of useEnablement in the chemical artsRegister today The USPTO looks forward to hearing the individual views of its customers and does not intend to use this forum to seek or arrive at any consensus advice.  Advanced registration is required. Once registered, you will be emailed instructions for joining the BCP.Agenda (coming soon)Join link: (coming soon) Webinar number: (coming soon)Webinar password: (coming soon)For more information, please email USPTOBCP1600@USPTO.GOV. Captioning service will be provided.",TC1600,"Patents, Events, Patents Partnership",20240319
15,Patents for librarians,https://www.uspto.gov/about-us/events/patents-librarians,"Tue, 19 Mar 2024 14:00:00 EST","Are you a librarian looking for a better understanding of patent concepts? Do you want to be able to share reliable resources with inventors looking to protect their intellectual property? The United States Patent and Trademark Office's Patent and Trademark Resource Center Program is offering a new webinar that introduces patent concepts and resources for professional librarians and library staff. This webinar will cover: An overview of patent concepts Types of patents Parts of a patent Steps to apply for a patent Patent and Trademark Resource Centers (PTRCs) and how they can help Additional resources Please register to attend this free virtual webinar, which will be held on Tuesday, March 19, from 2-3 p.m. E.T. Register todayFor more information, email PTRCP@uspto.gov.Accessibility",CISG,Patents,20240319
18,Trademarks for librarians,https://www.uspto.gov/about-us/events/trademarks-librarians,"Wed, 20 Mar 2024 14:00:00 EST","Are you a librarian looking for a better understanding of trademark concepts? Do you want to be able to share reliable resources with businesses looking to protect their intellectual property? The United States Patent and Trademark Office's Patent and Trademark Resource Center Program is offering a new webinar that introduces trademark concepts and resources for professional librarians and library staff. This webinar will cover: Types of trademarksTrademark application processBenefits of federal registrationCommon reasons for refusalUSPTO resourcesPatent and Trademark Resource Centers (PTRCs) and how they can help Please register to attend this free virtual webinar, which will be held Wednesday, March 20, from 2-3 p.m. ET. Register todayFor more information, email PTRCP@uspto.gov.Accessibility",CISG,Basic Facts,20240320
20,Learn the fundamentals of the patent application process,https://www.uspto.gov/about-us/events/learn-fundamentals-patent-application-process-4,"Tue, 19 Mar 2024 09:00:00 EST","Do you have an invention you want to patent? Are you unfamiliar with the patent filing process? Are you a first-time patent application filer or new to the Patent Center? Are you unsure where to start?Get a head StART with this free, virtual three-day workshop that focuses on helping participants learn the fundamentals of the patent application process. The Stakeholder Application Readiness Training (StART) is for independent inventors, entrepreneurs, and anyone working for or with a small business who want to file patent applications without the assistance of a registered patent agent or attorney.Patent protection is critical to:Safeguarding products and services from imitationAttracting and securing funding from outside investorsPromoting the overall commercial success of any enterpriseThe StART program is one of many initiatives and activities that form part of the USPTO’s mission. Participants of the StART three-day workshop will receive training from experts on:Types of patent applicationsPrior art searchesScope of claimsFormality requirementsClaim writing and claim draftingProper application forms (provisional, design, and non-provisional)Application data sheetPatent CenterDOCX filesParticipants may also choose to participate in one-on-one assistance breakout room discussions.Complete interest formInstructions for joining the training session are provided via email to each registrant. For more information, email setd@uspto.gov.",Patent Stakeholders,"Patents, START, About Us, Education",20240320
19,Virtual office hour with USPTO patent examiners,https://www.uspto.gov/jobs/virtual-office-hour-uspto-patent-examiners-8,"Wed, 20 Mar 2024 12:00:00 EST","Calling all scientists and engineers!Seeking a career at the United States Patent and Trademark Office (USPTO) as a patent examiner? If you are a U.S. citizen and are graduating this year with a focus in…BiologyBiomedical EngineeringChemistryChemical EngineeringComputer EngineeringComputer ScienceDesignElectrical EngineeringMechanical EngineeringPhysics …then bring your questions about the agency, the role, and the hiring process to this informal Q&A session with current USPTO patent examiners on March 20, at noon ET. Our team members are excited to answer your questions, chat with you, and provide you with more information about this opportunity. Join sessionYou do not need to register for this event but come prepared with any questions you may have. We hope to see you there! For more information, contact recruitment@uspto.gov. When you are ready to apply, submit your application via USAJOBS.",OHR,Events,20240320
21,Getting started with Patent Public Search,https://www.uspto.gov/about-us/events/getting-started-patent-public-search-0,"Thu, 21 Mar 2024 14:00:00 EST","Are you puzzled by patent searching or confused by the patent searching options available on the internet? Whether you are a novice searcher or an experienced one, the United States Patent and Trademark Office (USPTO) is here to help.  Librarians from the Patent and Trademark Resource Center Program, who are experienced with educating users on USPTO search tools, will show you how to use the new Patent Public Search tool. The virtual webinar will be held on Thursday, March 21, from 2-3 p.m. ET.Register todayFor more information pertaining to this webinar, please email PTRCP@uspto.gov.Accessibility",CISG,Prior Art,20240321
22,Learn the fundamentals of the patent application process,https://www.uspto.gov/about-us/events/learn-fundamentals-patent-application-process-4,"Tue, 19 Mar 2024 09:00:00 EST","Do you have an invention you want to patent? Are you unfamiliar with the patent filing process? Are you a first-time patent application filer or new to the Patent Center? Are you unsure where to start?Get a head StART with this free, virtual three-day workshop that focuses on helping participants learn the fundamentals of the patent application process. The Stakeholder Application Readiness Training (StART) is for independent inventors, entrepreneurs, and anyone working for or with a small business who want to file patent applications without the assistance of a registered patent agent or attorney.Patent protection is critical to:Safeguarding products and services from imitationAttracting and securing funding from outside investorsPromoting the overall commercial success of any enterpriseThe StART program is one of many initiatives and activities that form part of the USPTO’s mission. Participants of the StART three-day workshop will receive training from experts on:Types of patent applicationsPrior art searchesScope of claimsFormality requirementsClaim writing and claim draftingProper application forms (provisional, design, and non-provisional)Application data sheetPatent CenterDOCX filesParticipants may also choose to participate in one-on-one assistance breakout room discussions.Complete interest formInstructions for joining the training session are provided via email to each registrant. For more information, email setd@uspto.gov.",Patent Stakeholders,"Patents, START, About Us, Education",20240321
0,Igniting innovation: Empowering students through STEAM,https://www.uspto.gov/about-us/events/igniting-innovation-empowering-students-through-steam,"Thu, 21 Mar 2024 13:00:00 EST","For this month's K-12 education webinar, join the United States Patent and Trademark Office's (USPTO) Office of Education in a professional development session for educators held by USPTO as part of the 2024 ShareMyLesson Virtual Conference, on March 21 from 1-2 p.m. ET. Hear student inventors Nicolette Buonora and Lauren Strechay share their innovation journey. Nicolette and Lauren were recently issued U.S. Patent 11,892,131 for an invention that began in a high school engineering and robotics course. We'll discover firsthand how invention education tapped into their imagination and transformed their future possibilities. This session will also provide an opportunity to explore the online games, resources, and videos available to help educators incorporate invention into their curriculum and encourage an innovation mindset in all students. Register now to secure your spot. Visit the ShareMyLesson event page to learn more and sign up.Register hereThis webinar will be moderated by Juan Valentin, an education program advisor in the Office of Education. A patent examiner for 12 years before he joined the Office of Education, Juan directs the development and implementation of educational projects of national and international scope, with a particular emphasis on infusing STEM curriculums, design-based learning, and invention-focused projects with intellectual property (IP) concepts. Juan will be a fantastic resource for educators seeking new strategies and tools to integrate invention education and IP into their classrooms.USPTO professional development webinars The USPTO hosts monthly professional development webinars for K-12 educators interested in integrating IP, innovation, and invention activities into their STEM/STEAM curriculum. Whether you're a school administrator, teacher, student, parent, or caregiver, you are welcome to join us every month to hear from educators and learn about different types of IP, including patents, trademarks, copyrights, and trade secrets. These sessions can help inspire a classroom of problem solvers and shape career choices. Webinars are held once a month. Visit the USPTO's Office of Education page to learn more.For questions about the event, email education@uspto.gov.",education,Kids,20240321
23,Strategies for protecting and enforcing intellectual property in China: What Illinois businesses need to know,https://www.uspto.gov/about-us/events/strategies-protecting-and-enforcing-intellectual-property-china-what-illinois,"Tue, 26 Mar 2024 09:30:00 EST", ,OPIA,"China Team, Satellite Offices, Global IP Academy, Trade",20240326
24,SOaR presents -- How to use Patent Public Search tool (PPUBS) to search like an examiner,https://www.uspto.gov/about-us/events/soar-presents-how-use-patent-public-search-tool-ppubs-search-examiner-0,"Tue, 26 Mar 2024 13:00:00 EST","Are you interested in learning how to use the Patent Public Search tool (PPUBS) to search like an examiner? If so, Stakeholder Offerings and Resources (SOaR) has the training for you. On Tuesday, March 26, at 1 p.m. ET, SOaR will provide virtual training on how to use PPUBS, with live search demonstrations from an expert who will highlight techniques examiners use.Register todayThe PPUBS training will include:How to use PPUBS How examiners search Live search examplesThis training event is free to the public, however, preregistration is required. Once registered, you will receive instructions for joining the webinar via email.For more information on SOaR trainings, email SOaR@uspto.gov. Captioning service will be provided.",Patent Stakeholders,"Patents, SOAR",20240326
