,title,link,pubDate,description,page_owner,subject,date_index
25,Learn how to conduct a patent search at the USPTO Texas Regional Office,https://www.uspto.gov/about-us/events/learn-how-conduct-patent-search-uspto-texas-regional-office-5,"Tue, 26 Mar 2024 11:00:00 EST","Are you interested in learning more about patent searching?Register today to attend this in-person, interactive session on March 26 from 10-11:30 a.m. CT, led by United States Patent and Trademark Office (USPTO) experts who will demonstrate how to conduct a patent search using the Patent Public Search tool.Participants will learn basic information about:How to conduct a preliminary U.S. patent searchThe six-step patentability search strategyPatent searching toolsThis new web-based patent search tool replaces legacy search tools Public-Examiner’s Automated Search Tool (PubEast), Public-Web-based Examiner’s Search Tool (PubWest), Patent Full-Text and Image Database (PatFT), and Patent Application Full-Text and Image Database (AppFT), which were retired in September 2022.Register TodayFor more information about patent searching, visit the search for patents page on the USPTO website.For questions about this event, email the USPTO's Texas Regional Office at TexasRegionalOffice@uspto.gov or call 469-295-9000. Please feel free to bring your laptop and follow along. This event is strictly in-person and will not provide a virtual component.",Texas,"Search, Dallas",20240326
26,Public Symposium on AI and IP,https://www.uspto.gov/about-us/events/public-symposium-ai-and-ip,"Wed, 27 Mar 2024 13:00:00 EST", ,OUS,Initiatives,20240327
29,Attend DOCX filing training,https://www.uspto.gov/about-us/events/attend-docx-filing-training-185,"Thu, 28 Mar 2024 13:00:00 EST","Join us March, 28 1-2 p.m. ET (online) to learn how to file patent-related documents in DOCX format using Patent Center. You will hear from experts on the United States Patent and Trademark Office's (USPTO) eCommerce Modernization (eMod) team, who will provide demonstrations and answer your questions. This session is one of several free training sessions found on the DOCX filing series page.Instructions for joining the Webex training session will be provided via email to each registrant.DOCX is a word processing file format based on open standards and is supported by many popular word processing applications. As an open standard format, DOCX offers a safe and stable basis for authoring and processing intellectual property documents. Learn more about filing in DOCX in this hour-long session.We encourage you to explore DOCX filing using the Patent Center training mode at any time. Training mode does not save or store data in USPTO systems.Register todayFor more information, please contact eMod@uspto.gov. To provide feedback, please visit the eMod IdeaScale.",ecommerce,Patent Center,20240328
30,A day in the life of a USPTO patent examiner,https://www.uspto.gov/jobs/day-life-uspto-patent-examiner-2,"Thu, 28 Mar 2024 12:00:00 EST","Do you want a challenging career? Would you like the opportunity to work from home nationwide with a ﬂexible schedule? Do you want to be a part of a culture of inclusivity and camaraderie, and a community that leads America toward breakthroughs in innovation? Are you a U.S. citizen graduating this year with a focus in any of these fields?	Biology	Biomedical Engineering	Chemistry	Chemical Engineering	Computer Engineering	Computer Science	Design	Electrical Engineering	Mechanical Engineering	Physics 	If you answered yes to any of these questions, you may belong at the United States Patent and Trademark Office (USPTO) as a patent examiner! We recruit the most promising at America’s Innovation Agency, and we encourage you to take the step forward in your journey today by joining us on March 28 at noon ET for an informational webinar on becoming a patent examiner.",OHR,Events,20240328
28,USPTO PTAB/TTAB Stadium Tour – Live at Southern University,https://www.uspto.gov/about-us/events/uspto-ptabttab-stadium-tour-live-southern-university,"Thu, 28 Mar 2024 11:00:00 EST","Are you a patent or trademark attorney who appears before the Patent Trial and Appeal Board (PTAB) and/or the Trademark Trial and Appeal Board (TTAB)? Are you interested in learning about intellectual property law or practicing before the PTAB or TTAB? If so, you should join the United States Patent and Trademark Office (USPTO) and Southern University for an in-person PTAB/TTAB proceeding on March 28 from 10 a.m. to 7 p.m. CT at Southern University in Baton Rouge, Louisiana.Practitioners and students will have the opportunity to:Observe judges and counsel in action during the PTAB and TTAB proceedings.Attend a fireside chat with Derrick Brent, Deputy Under Secretary of Commerce for Intellectual Property and Deputy Director of the USPTO.Learn about the structure and format of PTAB proceedings and TTAB opposition proceedings.Join a networking reception after the proceedings and educational sessions.The program is free, but space is limited. We encourage you to register. If you have questions, email Marina A. Biragova, Director for Intellectual Property & Business Programs at SULC at MBiragova@sulc.edu.Presentation",PTAB,"Patent Trial and Appeal Board, Trademark Trial and Appeal Board (TTAB)",20240328
27,PTAB Inventor Hour – Episode 26,https://www.uspto.gov/about-us/events/ptab-inventor-hour-episode-26,"Thu, 28 Mar 2024 12:00:00 EST","Are you an inventor, entrepreneur, new practitioner, or someone who wants to learn more about the United States Patent and Trademark Office (USPTO) and Patent Trial and Appeal Board (PTAB)? Join us Thursday, March 28 at noon ET for the next PTAB Inventor Hour webinar, Episode 26. This episode will feature an interview with a special guest, Jacqueline Bonilla, Deputy Chief Administrative Judge of the PTAB & Senior Legal Advisor to the Director of the USPTO.Episode 26 will also feature:A review of a PTAB Case File (Ex parte Albritton, Appeal No. 2008-005023), including practice tips to help you succeed in ex parte appealsA showcase of an inventor in history: Maria BeasleyA question-and-answer session will follow the presentation. Please send questions before or during the webinar to PTABInventorHour@uspto.gov.Register here",PTAB,Patent Trial and Appeal Board,20240328
31,Federal trademark searching: Overview,https://www.uspto.gov/about-us/events/federal-trademark-searching-overview-1,"Fri, 29 Mar 2024 15:00:00 EST", ,Trademarks,Search,20240329
32,"Trademark Basics Boot Camp, Module 1: Fundamentals",https://www.uspto.gov/about-us/events/trademark-basics-boot-camp-module-1-fundamentals-15,"Tue, 02 Apr 2024 14:00:00 EST","Are you a small business owner or entrepreneur interested in learning about trademarks and how to apply for a federal registration? If so, this event is a must-attend. In this first module of our eight-part virtual Trademark Basics Boot Camp, we’ll focus on trademark protection in the United States. The event is free, but space is limited, so register early.This module will cover the following topics:Definitions and types of trademarksBenefits of federal registrationSelecting a trademarkFiling and registrationFinding help This module will be presented live via Webex from 2-3:30 p.m. ET on Tuesday, April 2, 2024, and will conclude with a question-and-answer session. Please register by April 1. Register todayBe sure to check out our other boot camp modules running consecutively every week for the eight-week duration. You can attend the whole series or just the specific modules that best meet your needs. Separate registration is required for each module. After each event, we'll email registrants links to a video recording of the module and a PDF of the presentation materials. You will only receive access to the recording if you are signed up for that module.For questions about the event or the boot camp series, please contact TMWebinar@uspto.gov.",Trademarks,"Trademarks, Basic Facts, Education, Atlantic, Alexandria VA (Headquarters), Dallas, Denver, Silicon Valley, Detroit",20240402
0,Virtual office hour with USPTO patent examiners,https://www.uspto.gov/jobs/virtual-office-hour-uspto-patent-examiners-9,"Wed, 03 Apr 2024 12:00:00 EST","Calling all scientists and engineers!Seeking a career at the United States Patent and Trademark Office (USPTO) as a patent examiner? If you are a U.S. citizen and are graduating this year with a focus in…BiologyBiomedical EngineeringChemistryChemical EngineeringComputer EngineeringComputer ScienceDesignElectrical EngineeringMechanical EngineeringPhysics …then bring your questions about the agency, the role, and the hiring process to this informal Q&A session with current USPTO patent examiners on April 3 at noon ET. Our team members are excited to answer your questions, chat with you, and provide you with more information about this opportunity. Join sessionYou do not need to register for this event but come prepared with any questions you may have. We hope to see you there! For more information, contact recruitment@uspto.gov. When you are ready to apply, submit your application via USAJOBS.",OHR,Events,20240403
33,One-day patents boot camp,https://www.uspto.gov/about-us/events/one-day-patents-boot-camp-9,"Thu, 04 Apr 2024 10:00:00 EST","Join the United States Patent and Trademark Office (USPTO) for a one-day patents boot camp on April 4, 2024 from 9 a.m. to 5 p.m. CT at WKU Innovation Campus in Bowling Green, KY.   This in-person, single-day workshop is for entrepreneurs, small businesses, and inventors in communities with limited or no internet access, covering tools, techniques, and resources to understand the patent application process.The event provides a scaffolded approach to understanding patents and intellectual property (IP) rights, the importance of claims in a patent application, and the various patent application requirements. It also includes:How to search prior artHow to properly draft claims Understanding the application formsHow to use Patent Center to file electronicallyThere will be plenty of question-and-answer sessions throughout the day, plus a discussion about free resources available through the USPTO. This event is free, but registration is required. For registration information, questions about the one-day event or the One-day patent and trademark boot camp series, please email Andriae.Holt@uspto.gov.",Patents,"Patents, SOAR, Training",20240404
34,"Ex Parte Appeal Roadshows - Indianapolis, Indiana",https://www.uspto.gov/about-us/events/ex-parte-appeal-roadshows-indianapolis-indiana,"Thu, 04 Apr 2024 13:00:00 EST","Are you a Patent Trial and Appeal Board (PTAB) practitioner? Would you like to learn more about ex parte appeal proceedings directly from PTAB judges? Attend an Ex Parte Appeal Roadshow.The PTAB is holding in-person training focusing on best practices to succeed in an appeal on Thursday, April 4, at the Indianapolis Central Library from 1-5 p.m. ET. PTAB judges will teach all sessions. Topics include:Tips to file an appeal brief efficientlyHow to make written arguments more persuasiveHow to present an effective oral argument before a judge panelSee the agenda for more information. The event is free and registration is encouraged. The Ex Parte Appeal Roadshow will also take place in Los Angeles, Austin, Atlanta, and Philadelphia. See the full schedule for dates. If you have any questions regarding this event, please email PTABEvents@uspto.gov.CLE credit is pending per state for each roadshow location.",PTAB,Patent Trial and Appeal Board,20240404
0,"The Path to a Patent, Part I: IP basics",https://www.uspto.gov/about-us/events/path-patent-part-i-ip-basics-12,"Thu, 04 Apr 2024 14:00:00 EST","Are you interested in learning about intellectual property (IP) basics? In part one of this eight-part recurring series, our experts will:Provide a brief overview of the different types of IP (patents, trademarks, trade secrets, and copyrights)Review the patenting process from invention, to application, to issueCover the requirements for patentabilityExplain how to determine whether a provisional or nonprovisional application is right for youDiscuss how to weigh the costs and benefits of hiring a patent attorneyRegister todayFor more information, please email  RockyMountain@uspto.gov or SiliconValley@uspto.gov.",Svalley,"Patents, Trademarks, Alexandria VA (Headquarters), Dallas, Denver, Silicon Valley, Detroit",20240404
35,One-day trademarks boot camp,https://www.uspto.gov/about-us/events/one-day-trademarks-boot-camp-11,"Fri, 05 Apr 2024 10:00:00 EST","This event has been postponed until further notice. Please refer to this listing for updates and information.Join the United States Patent and Trademark Office (USPTO) for a one-day trademarks boot camp on April 5, 2024 from 9 a.m. to 5 p.m. CT at WKU Innovation Campus in Bowling Green, KY.  This is an in-person, single-day workshop for entrepreneurs, small businesses, and start-ups in communities with limited or no internet access, covering what they should know about trademarks.The event explores what trademarks are, the benefits of federal trademark registration, and the basics of the registration process. We’ll also discuss why it’s so important for any new business to select a trademark that is both federally registrable and legally protectable.Topics will include:Fundamentals and searchingApplications and filingResponses and registrationThere will be plenty of question-and-answer sessions throughout the day, plus a discussion about free resources available through the USPTO. This event is free, but registration is required. For registration information, questions about the one-day event, or the One-day patents and trademarks boot camp series, please email Andriae.Holt@uspto.gov.",Patents,"Patents, SOAR, Training",20240405
36,"Trademark Basics Boot Camp, Module 2: Registration process overview",https://www.uspto.gov/about-us/events/trademark-basics-boot-camp-module-2-registration-process-overview-11,"Tue, 09 Apr 2024 14:00:00 EST","Are you a small business owner or entrepreneur interested in learning about trademarks and how to apply for a federal registration? If so, this event is a must-attend. In this second module of our eight-part virtual Trademark Basics Boot Camp, we’ll focus on the overall trademark registration process, from filing to registration. Understanding the process is critical to avoid missing any filing deadlines, which could jeopardize your application or registration. The event is free, but space is limited, so register early.In this module, we will cover the following topics:Trademark basicsApplication workflow and timeline overviewPost-registration workflow overviewFinding helpThis module will be presented live via Webex from 2-3:30 p.m. ET on Tuesday, April 9, 2024, and will conclude with a question-and-answer session. Please register by April 8.Register todayBe sure to check out our other boot camp modules running consecutively every week for the eight-week duration. You can attend the whole series or just the specific modules that best meet your needs. Separate registration is required for each module. After each event, we'll email registrants links to a video recording of the module and a PDF of the presentation materials. You will only receive access to the recording if you are signed up for that module.For questions about the event or the boot camp series, please contact TMWebinar@uspto.gov.",Trademarks,"Trademarks, Basic Facts, Education, Atlantic, Alexandria VA (Headquarters), Dallas, Denver, Silicon Valley, Detroit",20240409
0,Virtual office hour with USPTO patent examiners,https://www.uspto.gov/jobs/virtual-office-hour-uspto-patent-examiners-10,"Wed, 10 Apr 2024 12:00:00 EST","Calling all scientists and engineers!Seeking a career at the United States Patent and Trademark Office (USPTO) as a patent examiner? If you are a U.S. citizen and are graduating this year with a focus in…BiologyBiomedical EngineeringChemistryChemical EngineeringComputer EngineeringComputer ScienceDesignElectrical EngineeringMechanical EngineeringPhysics …then bring your questions about the agency, the role, and the hiring process to this informal Q&A session with current USPTO patent examiners on April 10 at noon ET. Our team members are excited to answer your questions, chat with you, and provide you with more information about this opportunity. Join sessionYou do not need to register for this event but come prepared with any questions you may have. We hope to see you there! For more information, contact recruitment@uspto.gov. When you are ready to apply, submit your application via USAJOBS.",OHR,Events,20240410
0,Attend DOCX filing training,https://www.uspto.gov/about-us/events/attend-docx-filing-training-186,"Thu, 11 Apr 2024 14:00:00 EST","Join us April 11, 2-3 p.m. ET (online) to learn how to file patent-related documents in DOCX format using Patent Center. You will hear from experts on our eCommerce Modernization (eMod) team who will provide demonstrations and answer your questions. This session is one of several free training sessions found on the DOCX filing series page.Instructions for joining the Webex training session will be provided via email to each registrant.DOCX is a word processing file format based on open standards and is supported by many popular word processing applications. As an open standard format, DOCX offers a safe and stable basis for authoring and processing intellectual property documents. Learn more about filing in DOCX in this hour-long session.We encourage you to explore DOCX filing using the Patent Center training mode at any time. Training mode does not save or store data in our systems.Register todayFor more information, please contact eMod@uspto.gov. To provide feedback, please visit the eMod IdeaScale.",ecommerce,Patent Center,20240411
0,"The Path to a Patent, Part II: Drafting provisional patent applications",https://www.uspto.gov/about-us/events/path-patent-part-ii-drafting-provisional-patent-applications-5,"Thu, 11 Apr 2024 14:00:00 EST","In part two of this eight-part recurring series, our experts discuss key differences between provisional and nonprovisional patent applications, filing requirements and fees, the different ways to file a provisional application, and more.Register todayFor more information, please email SiliconValley@uspto.gov or RockyMountain@uspto.gov.",Svalley,"Alexandria VA (Headquarters), Dallas, Denver, Silicon Valley, Detroit",20240411
37,Patent Pro Bono Program: Pathways to Inclusive Innovation,https://www.uspto.gov/about-us/events/patent-pro-bono-program-pathways-inclusive-innovation-1,"Fri, 12 Apr 2024 09:00:00 EST", ,OGC,Pro Bono,20240412
0,Attend the Technology Center 2600 Customer Partnership Meeting,https://www.uspto.gov/about-us/events/attend-technology-center-2600-customer-partnership-meeting,"Tue, 16 Apr 2024 13:00:00 EST","Register today to attend the Technology Center (TC) 2600’s virtual Customer Partnership Meeting (CPM) on Tuesday, April 16, from 1-3 p.m. ET. The event is free and open to the public. The United States Patent and Trademark Office's (USPTO) TCs are patent application examination units, with each TC assigned to different fields of technology. The TC2600 examines the technology of communications applications, and this CPM focuses on the electrical arts. The event is virtual and designed to help enhance stakeholders’ direct engagement with USPTO leaders and learn about topics that affect the prosecution of patent applications. Register todayThe theme of this year’s virtual event is “Interview Practice.” By attending this year’s TC2600 CPM, you can:Learn more about quality improvement strategies and interview practiceGain insight on how examiners make decisionsProvide valuable feedbackDevelop positive working relationships with TC2600 personnelWhile there is no charge to attend the TC2600 CPM, advance registration is required. For inquiries or to provide suggestions for future TC2600 CPM topics, please email TC2600CustomerPartnership@uspto.gov.",TC2600,"Patents, Events, Patents Partnership",20240416
38,"Trademark Basics Boot Camp, Module 3: Searching",https://www.uspto.gov/about-us/events/trademark-basics-boot-camp-module-3-searching-11,"Tue, 16 Apr 2024 14:00:00 EST","Are you a small business owner or entrepreneur interested in learning about trademarks and how to apply for a federal registration? If so, this event is a must-attend. In this third module of our eight-part virtual Trademark Basics Boot Camp, we'll focus on important principles related to federal trademark clearance searching and effective use of the USPTO’s trademark database. The event is free, but space is limited, so register early.This module will cover the following topics:Trademark basicsLikelihood of confusionFederal trademark searchingFinding help  This module will be presented live via Webex from 2-3:30 p.m. ET on Tuesday, April 16, 2024, and will conclude with a question-and-answer session. Please register by April 15.Register todayBe sure to check out our other boot camp modules running consecutively every week for the eight-week duration. You can attend the whole series or just the specific modules that best meet your needs. Separate registration is required for each module. After each event, we'll email registrants links to a video recording of the module and a PDF of the presentation materials. You will only receive access to the recording if you are signed up for that module.For questions about the event or the boot camp series, please contact TMWebinar@uspto.gov.",Trademarks,"Trademarks, Basic Facts, Education, Atlantic, Alexandria VA (Headquarters), Dallas, Denver, Silicon Valley, Detroit",20240416
39,A fireside chat with USPTO patent examiners,https://www.uspto.gov/jobs/fireside-chat-uspto-patent-examiners-1,"Wed, 17 Apr 2024 12:00:00 EST",Come join us for a laid back and informational fireside chat that will give you an inside look at being a patent examiner at the USPTO. You will get the opportunity to engage in insightful conversations and get answers to your questions directly from team members.,OHR,Events,20240417
0,"The Path to a Patent, Part III: Patent searching",https://www.uspto.gov/about-us/events/path-patent-part-iii-patent-searching-7,"Thu, 18 Apr 2024 14:00:00 EST","Are you interested in learning more about patent searching?In part three of this eight-part recurring series, our experts will discuss preliminary searching using the suggested seven-step strategy and more.Register todayFor more information, please email RockyMountain@uspto.gov or SiliconValley@uspto.gov.",Svalley,"Alexandria VA (Headquarters), Dallas, Denver, Silicon Valley, Detroit",20240418
40,One-day patents boot camp,https://www.uspto.gov/about-us/events/one-day-patents-boot-camp-11,"Thu, 18 Apr 2024 09:00:00 EST","Join the United States Patent and Trademark Office (USPTO) for a one-day patents boot camp on April 18, 2024 from 9 a.m. to 5 p.m. ET at the Summit Station at Innovation Center in Frostburg, Maryland. This is an in-person, single-day workshop for entrepreneurs, small businesses, and inventors in communities with limited or no internet access, covering tools, techniques, and resources to understand the patent application process.The event provides a scaffolded approach to understanding patents and intellectual property (IP) rights, the importance of claims in a patent application, and the various patent application requirements. It also includes:How to search prior artHow to properly draft claims Understanding the application formsHow to use Patent Center to file electronicallyThere will be plenty of question-and-answer sessions throughout the day, plus a discussion about free resources available through the USPTO. This event is free, but registration is required. For registration information, questions about the one-day event or the One-day patent and trademark boot camp series, please email Andriae.Holt@uspto.gov.",Patents,"Patents, SOAR, Training",20240418
41,"Trademark Basics Boot Camp, Module 4: Application requirements",https://www.uspto.gov/about-us/events/trademark-basics-boot-camp-module-4-application-requirements-11,"Tue, 23 Apr 2024 14:00:00 EST","Are you a small business owner or entrepreneur interested in learning about trademarks and how to apply for a federal registration? If so, this event is a must-attend. In this fourth module of our eight-part virtual Trademark Basics Boot Camp, we’ll focus on the requirements for an initial trademark application. Knowing what is needed up front will help your filing process go more smoothly. The event is free, but space is limited, so register early.This module will cover the following topics:Trademark basicsDrawingsIdentifications of goods and servicesFiling basesSpecimens and ornamentationFinding helpThis module will be presented live via Webex from 2-3:30 p.m. ET on Tuesday, April 23, 2024, and will conclude with a question-and-answer session. Please register by April 22. Register todayBe sure to check out our other boot camp modules running consecutively every week for the eight-week duration. You can attend the whole series or just the specific modules that best meet your needs. Separate registration is required for each module. After each event, we'll email registrants links to a video recording of the module and a PDF of the presentation materials. You will only receive access to the recording if you are signed up for that module.For questions about the event or the boot camp series, please contact TMWebinar@uspto.gov.",Trademarks,"Trademarks, Basic Facts, Education, Atlantic, Alexandria VA (Headquarters), Dallas, Denver, Silicon Valley, Detroit",20240423
